{
  "$schema": "../../schemas/driver-season-entries.schema.json",
  "kind": "driver-season-entries",
  "status": "mock",
  "note": "NON-AUTHORITATIVE development data. The alpine seat demonstrates a mid-season driver change via round spans.",
  "season": 2026,
  "entries": [
    {
      "id": "2026-max-verstappen",
      "season": 2026,
      "driverId": "max-verstappen",
      "constructorId": "red-bull",
      "raceNumber": 1,
      "role": "race",
      "shortCode": "VER",
      "startRound": null,
      "endRound": null
    },
    {
      "id": "2026-george-russell",
      "season": 2026,
      "driverId": "george-russell",
      "constructorId": "mercedes",
      "raceNumber": 63,
      "role": "race",
      "shortCode": "RUS",
      "startRound": null,
      "endRound": null
    },
    {
      "id": "2026-charles-leclerc",
      "season": 2026,
      "driverId": "charles-leclerc",
      "constructorId": "ferrari",
      "raceNumber": 16,
      "role": "race",
      "shortCode": "LEC",
      "startRound": null,
      "endRound": null
    },
    {
      "id": "2026-lewis-hamilton",
      "season": 2026,
      "driverId": "lewis-hamilton",
      "constructorId": "ferrari",
      "raceNumber": 44,
      "role": "race",
      "shortCode": "HAM",
      "startRound": null,
      "endRound": null
    },
    {
      "id": "2026-lando-norris",
      "season": 2026,
      "driverId": "lando-norris",
      "constructorId": "mclaren",
      "raceNumber": 4,
      "role": "race",
      "shortCode": "NOR",
      "startRound": null,
      "endRound": null
    },
    {
      "id": "2026-oscar-piastri",
      "season": 2026,
      "driverId": "oscar-piastri",
      "constructorId": "mclaren",
      "raceNumber": 81,
      "role": "race",
      "shortCode": "PIA",
      "startRound": null,
      "endRound": null
    },
    {
      "id": "2026-jack-doohan",
      "season": 2026,
      "driverId": "jack-doohan",
      "constructorId": "alpine",
      "raceNumber": 7,
      "role": "race",
      "shortCode": "DOO",
      "startRound": null,
      "endRound": 9
    },
    {
      "id": "2026-franco-colapinto-10",
      "season": 2026,
      "driverId": "franco-colapinto",
      "constructorId": "alpine",
      "raceNumber": 43,
      "role": "race",
      "shortCode": "COL",
      "startRound": 10,
      "endRound": null
    }
  ]
}
